<?xml version="1.0" encoding="utf-8"?>
<xs:schema targetNamespace="http://tempuri.org/XMLSchema.xsd"
    elementFormDefault="qualified"
    xmlns="http://tempuri.org/XMLSchema.xsd"
    xmlns:mstns="http://tempuri.org/XMLSchema.xsd"
    xmlns:xs="http://www.w3.org/2001/XMLSchema"
>
  <xs:element name="workout">
    <xs:complexType>
      <xs:sequence>
        <xs:element name="name" type="xs:string"/>
        <xs:element name="description" type="xs:string"/>
        <xs:element name="exercises">
          <xs:complexType>
            <xs:sequence>
              <xs:element name="exercise" maxOccurs="unbounded">
                <xs:complexType>
                  <xs:sequence>
                    <xs:element name="name" type="xs:string"/>
                    <xs:element name="sets" type="xs:int"/>
                    <xs:element name="reps" type="xs:int"/>
                    <xs:element name="description">
                      <xs:complexType>
                        <xs:sequence>
                          <xs:element name="text" type="xs:string"/>
                          <xs:element name="image" type="xs:string"/>
                          <xs:element name="video" type="xs:string"/>
                        </xs:sequence>
                      </xs:complexType>
                    </xs:element>
                    <xs:element name="muscle">
                      <xs:complexType>
                        <xs:sequence>
                          <xs:element name="name" type="xs:string"/>
                          <xs:element name="image" type="xs:string"/>
                        </xs:sequence>
                      </xs:complexType>
                    </xs:element>
                  </xs:sequence>
                </xs:complexType>
              </xs:element>
            </xs:sequence>
          </xs:complexType>
        </xs:element>
      </xs:sequence>

    </xs:complexType>
  </xs:element>
</xs:schema>
